_id,judul,author,penerbit,imageUrl,sinopsis,tanggal,bulan,tahun,halaman,harga,kategori,isbn,promo,rentbook,diskon,pdfPath
662a307019e396f54db04baa,Inspirasi & Motivasi B.J. HABIBIE,Punto Ali Fahmi,Checklist,https://id-test-11.slatic.net/p/59bf6a5ca6e300332e69a0c30f1490a6.jpg,"Prof. Dr. Ing. H. Bacharuddin Jusuf Habibie, seorang putra bangsa yang memiliki segudang prestasi baik nasional maupun internasional. presiden ke 3 Republik Indonesia ini terkenal sebagai si jenius dalam bidang kedirgantaraan.Tanpa mengenal lelah dan menyerah, hari-harinya didedikasikan penuh untuk bangsa dan negeri tercinta. Semangatnya yang begitu menggelora dan kisah hidupnya yang luar biasa hebat begitu menginspirasi masyarakat Indonesia.Buku ini menapak tilas perjalanan hidup B.J. Habibie, mulai dari masa kecilnya hingga menjelang akhir hayatnya. Dari kisah sang insinyur ini, kita bisa mengambil banyak pesan dan hikmah yang sangat bermanfaat bagi hidup kita.Beberapa bahasan yang diangkat di dalam buku ini, antara lain:Bagaimana masa kecil BJ. Habibie?Bagaimana perjuangan BJ. Habibie selama menempuh pendidikan diIndonesia dan Jerman?Apa saja prestasi dan karya BJ. Habibie?Bagaimana sepak terjang BJ. Habibie dalam industri pesawat terbang Indonesia?Bagaimana kiprah BJ. Habibie semasa menjadi politikus?Apa saja kebijakan yang dikeluarkan B.J Habibie selama menjadi presiden?Siapa orang yang berperan penting dalam hidup BJ. Habibie?BJ. Habibie memang telah berpulang, tapi sosoknya dan baktinya terhadap tanah air akan terus terkenang.Buku ini layak dibaca oleh semua kalangan untuk meneladani semangat juang dan dedikasi B. J. Habibie dalam mengembangkan dunia dirgantara. Kiranya, semangat dan dedikasi Habibie dapat menginspirasi kita semua untuk membawa bangsa ini kepada kegemilangan.",4,Desember,2019,200,54000,inspirasi,9786237046868,Disable,Disable,,
662a307019e396f54db04bab,Akasha : Solanin - Special Edition,Inio Asano,m&c!,https://cdn.gramedia.com/uploads/picture_meta/2023/8/17/jcpsw9qfkibdyezixtjwju.jpg,"Saat ini pun, kadang melodi itu masih terdengar kembali.Tapi aku takkan bisa kembali ke diriku dimasa itu¦ karena aku sudah berjalan terlalu jauh.Dan aku akan terus melangkah maju.Meski jalan itu berliku tajam dan membentang sampai ujung dunia.Sebuah komik populer yang mengundang simpati dan dukungan deras dari seluruh Jepang kini hadir dalam versi baru!Volume ini mencakup ""Episode 29"", karya baru pertama yang digambar dalam 12 tahun Datanglah Musim Semi, dan ilustrasi warna yang belum pernah dipublikasikan sebelumnya.",16,Agustus,2023,472,118000,komik,9786230310966,Disable,Disable,,
662a307019e396f54db04bac,Akasha : Neon Genesis Evangelion - Collector's Edition 03,Yoshiyuki Sadamoto/khara/ Gainax,m&c!,https://cdn.gramedia.com/uploads/picture_meta/2024/2/16/ademqudiwx943kpy3dwshj.jpg,"Saat Shinji dan ayahnya mengunjungi makam ibunya, Angel kembali menyerang! Saat ini tiga unit Eva bekerja sama untuk menghadang Angel!",15,Februari,2024,368,110000,komik,9786230312182,Disable,Disable,,
662a307019e396f54db04bad,Buku Pintar Percakapan Bahasa Arab,Syarif Zahir,E Prim,https://cdn.gramedia.com/uploads/items/9786023980338_Buku-Pintar-Percakapan-Bahasa-Arab.jpg,Salah satu cara yang efektif untuk belajar bahasa Arab adalah dengan langsung belajar percakapan dari keseharian yang biasa dilakukan. Begitu juga untuk anak-anak maupun orang dewasa yang ingin belajar bahasa Arab secara otodidak. Untuk itu buku Buku Pintar Percakapan Bahasa Arab karya Syarif Zahir ini hadir dengan konsep pembelajaran yang sangat menyenangkan dan juga mudah. Sangat menyenangkan karena materi yang disajikan sangatlah dekat dengan dunia keseharian dan juga disajikan dengan bahasa yang sangat menarik dan mudah dimengerti.,19,April,2018,200,55000,bahasaasing,9786023980338,Disable,Disable,,
662a307019e396f54db04bae,Keajaiban Air Mineral Bagi Kesehatan,"Karina Nurin R & Anzhor Adhi S, Amd.Kep",Unicorn Publishing,https://cdn.gramedia.com/uploads/items/keajaiban-air-mineral-bagi-kesehatan-55-KEAJAIBAN_AIR_MINERAL.jpg,"Sangat penting bagi kita untuk menjaga kesehatan. Melalui buku kesehatan yang bertajuk Keajaiban Air Mineral Bagi Kesehatan ini, penulis memberikan sebuah terapi yang sangat bermanfaat bagi kesehatan dan kelangsungan hidup Anda.Buku ini menyajikan 10 bab pembahasan tentang manfaat Air mineral bagi kesehatan.Dengan bahasa yang mudah dipahami serta dilengkapi dengan penjelasan ilmiah, diharapkan agar pembaca dengan mudah untuk menyerap setiap ilmu yang dibahas dalam buku ini. Sebab, hidup sehat adalah prioritas utama Anda.",4,September,2019,216,45500,medis,9786237210023,Disable,Disable,,
662a307019e396f54db04baf,10 Steps To A More Fulfilling Life: Menjadi Pribadi yang Bahagia & Inspiratif,Dale Carnegie,Bhuana Ilmu Populer,https://ebooks.gramedia.com/ebook-covers/65693/image_highres/BLK_MPYBDI2021879020.jpg,"Sebagian orang, menikmati hidup berlimpah dan sempurna yang mereka miliki. Orang-orang ini ibarat sebuah magnet; sangat bersinar, riang, dan menarik, sampai-sampai mereka tak perlu memaksa atau meminta orang lain untuk “membukakan jalan” bagi mereka. Pintu-pintu akan selalu terbuka lebar dan mengundang mereka untuk memasukinya. Kehadiran mereka juga akan membuat orang lain menjadi nyaman dan bahagia. Mereka paham bagaimana cara terbaik untuk membujuk orang lain, bahkan tanpa harus mengucapkan sepatah kata pun. Mereka sangat populer dalam lingkungan sosial dan pergaulan, bahkan pekerjaan dan karier mereka pun dapat melesat dengan pesat.Kemudian, dapatkah Anda menjelma menjadi pribadi yang menggoda ini? Ya, tentu saja bisa hanya dengan membaca buku yang satu ini!",7, Juli,2021,280,85000,inspirasi,9786230403910,Disable,Disable,,
662a307019e396f54db04bb0,250++ Tanya Jawab Seputar Kanker - Jawaban Para Ahli,"Prof. Dr. Dr. Soehartati Gondhowiardjo, Sp.Rad(K)Onk.Rad",UI Publishing,https://cdn.gramedia.com/uploads/items/250_Tanya_Jawab_Seputar_Kanker_Jawaban_Para_Ahli.jpg,"Seperti yang diketahui bahwa penyakit kanker merupakan salah satu penyakit yang seringkali diderita. Kebanyakan penderita penyakit kanker sendiri kebanyakan tidak menyadari bahwa telah menderita penyakit kanker. Sehingga, keterlambatan dalam mengindikasi kanker tersebut membuat sel-sel kanker yang ada dalam tubuh penderita lebih sulit untuk disembuhkan.Melalui buku ini, penulis menyajikan informasi yang padat mengenai penyakit kanker. Penulis pun menjelaskan, untuk menang melawan penyakit kanker deteksi dini adalah hal yang berperan sangat penting. Selain itu, upaya-upaya pencegahan pun dapat menekan angka kematian orang yang menderita kanker.Penulis mengatakan, bahwa buku ini ditujukan untuk para penyintas, keluarga maupun masyarakat awam agar lebih mengenal mengenai penyakit kanker. Melalui informasi yang disajikan dalam buku ini, penulis berharap bahwa para penyintas kanker dapat mengenal lebih dalam mengenai kanker itu sendiri.",26,November,2021,159,120000,medis,9786025140570,Disable,Disable,,
662a307019e396f54db04bb1,Level Comic: Bungo Stray Dogs 02,Kafka Asagiri,Elex Media Komputindo,https://cdn.gramedia.com/uploads/picture_meta/2022/11/25/hxwhnt79lwt4zrmjbbx7gk.jpg,"Setelah melalui pertarungan sengit dengan Akutagawa, lalu siuman di ruang perawatan kantor Agensi Detektif Bersenjata, Atsushi Nakajima kabur karena merasa tidak boleh merepotkan agensi lebih dari ini. Namun, Mafia mengirimkan Ryuro Hirotsu dari Kelompok Petarung ""Kadal Hitam"" yang keji ke kantor agensi!? Tidak hanya itu, para pemilik kemampuan khusus dari Port Mafia pun berturut-turut menyerang, seperti Motojiro Kajii si pengebom dan Kyoka Izumi si gadis kecil berpakaian tradisional. Simak jilid 2 dari kisah aksi pertarungan antartokoh sastra pemilik kemampuan khusus ini!!",29,November,2022,204,50000,komik,9786230036422,Disable,Disable,,
662a307019e396f54db04bb2,Educomics Plants vs Zombies Komik Sains Robot: Aku Superstar!,Xiao Jiang Nan,Bhuana Ilmu Populer,https://cdn.gramedia.com/uploads/picture_meta/2022/11/24/hxdbobdhuommd3mkrgkv4e.jpg,"Solar Flare ingin menjadi superstar. Dia bersama Green Shadow mendatangi Pameran Film Starlight. Namun saat perjalanan pulang, mereka dihadang oleh robot milik Super Brainz. Tidak disangka, pertempuran mereka melawan robot itu menarik perharian Sutradara Imitater yang berencana ingin membuat film aksi-fiksi ilmiah. Pencarian dana untuk membuat film dan mencari pemeran film pun dimulai. Super Brainz yang mengetahui rencana Plant dalam membuat film, ingin menyabotase pembuatan film tersebut. Berhasilkan para Plant membuat film aksi-fiksi ilmiah ini? Yuk, ikuti kisah mereka dalam berhadapan dengan Super Brainz! Komik Plants vs Zombie Robot Sains ini mengisahkan Green Shadwo dan Solar Flare bersama robot mereka meleawan robot-robot yang diciptakan Dr. Zomboss. Seri ini berisikan informasi mengenai robot dan kegunaannya yang disukai anak-anak.",29,November,2022,162,125000,komik,9786230410161,Disable,Disable,,
662a307019e396f54db04bb3,"Covid-19 Update: New Normal, Vaksinasi, Dan Fakta-Fakta Baru Yang Perlu Anda Ketahui",Diyan Yulianto,Arruz Media,https://cdn.gramedia.com/uploads/items/9786023135998.jpg,"Telah lebih dari setahun masyarakat di seluruh dunia hidup di bawah bayang-bayang pandemi Covid-19. Pandemi yang belum diketahui kapan pastinya akan mereda, memaksa kita untuk beradaptasi dengan bermacam kebiasaan yang baru. Hidup normal di masa pandemi tentu akan terasa sangat berbeda dengan kehidupan normal sebelum adanya pandemi. Mau tak mau, kita harus menyelaraskan diri beraktivitas dengan serangkaian protokol kesehatan yang telah ditentukan.",30,Mei,2021,158,50000,medis,9786023135998,Disable,Disable,,
662a307019e396f54db04bb4,Tentang Tubuhmu,dr. Gia Pratama,Qanita,https://cdn.gramedia.com/uploads/items/Mockup-Isi-Buku-Terbuka.jpg,Tentang Tubuhmu,16,September,2020,190,95000,medis,9786024021818,Disable,Disable,,
662a307019e396f54db04bb5,How To See?,Asabell Audida,Romancious,https://filebroker-cdn.lazada.co.id/kf/Se71000280f754797812fbb1faa26dba0c.jpg,"Vee, sosok makhluk yang mampu membentangkan sayap raksasa di punggungnya---guardian yang dibebani dengan tanggung jawab menjaga keseimbangan dunia.Sebuah peristiwa membuatnya harus kehilangan healer-nyasosok penyembuh yang menyempurnakan dirinya.Membutuhkan keabadian, Vee butuh healer pengganti. Hanya ada satu cara untuk Vee kembali menjadi guardian yang sempurna, cara mendapatkan healer yang mampu mengimbangi dirinya. Ia harus menemukan Sky---satu-satunya yang bisa membantunya mendapatkan healer lagi.Sky, manusia yang takut gelap, harus mengalami kebutaan karena suatu kecelakaan. Hal ini membuatnya kerap putus asa atas kondisinya. Namun, semuanya berubah saat Vee datang ke kehidupannya, memberikannya secercah harapan yang tak pernah ia duga sebelumnya, dengan satu penawaran yang tak kalah mengejutkannya.Lantas, bagaimanakah keputusan Sky?Apakah ia akan menerima tawaran Vee agar bisa melihat kembali?Apakah Sky siap untuk hidup dengan makhluk yang tidak pernah ia lihat sebelumnya?Atau, memilih untuk buta selamanya?*Vee: ""Aku bisa membuatmu melihat lagi. Apa kau mau?""Sky: ""Ta-tapi, ak-aku ingin pulang. Aku tidak mau melakukannya.Vee: ""Jika kau terus menangis, aku tidak akan pernah memulangkanmu.""Sky: ""Jadi, aku bisa pulang?""Vee: ""Bisa, setelah kau memberikanku healer yang sempurna.""",19,Juli,2009,280,99500,novel,9786233100151,Disable,Disable,,
662a307019e396f54db04bb6,Sapiens,Yuval Noah Harari,Kepustakaan Populer Gramedia,https://cdn.gramedia.com/uploads/items/591701404_sapiens.jpg,"Yuval Harari menceritakan kisah penciptaan dan evolusi umat manusia, menjelajahi cara-cara biologi dan sejarah telah mendefinisikan kita dan meningkatkan pemahaman kita tentang apa artinya menjadi manusia. Dari peran seorang manusia yang berevolusi dalam ekosistem global, hingga memetakan kebangkitan kerajaan. Sapiens menantang kita untuk mempertimbangkan kembali kepercayaan yang diterima, menghubungkan perkembangan masa lalu dengan masalah kontemporer, dan melihat peristiwa tertentu dalam konteks gagasan yang lebih besar. Sapiens membahas sisi yang tak banyak diungkit buku sejarah atau evolusi manusia lain: bagaimana manusia berangkat dari sekadar satu spesies hewan menjadi makhluk berperadaban, melalui tiga revolusi” Kognitif, Pertanian, dan Sains. Telusuri peran bahasa, pertanian, sampai gosip dan fiksi dalam kesuksesan manusia, juga arti kebahagiaan manusia dan ujung riwayat spesies kita. Menarik dan provokatif... membuat kita sadar bahwa kita baru sebentar hadir di Bumi ini, bahwa pertanian dan sains baru-baru saja ada, dan sebaiknya kita jangan menganggap enteng semua itu. - Presiden Barack Obama",10,September,2017,544,125000,sejarah,9786024244163,Disable,Disable,,